id,dex_number,slug,description,enabled,catchable,abundance,name.ja,name.ja_r,name.ja_t,name.en,name.de,name.fr,type.0,type.1,mythical,legendary,ultra_beast,height,weight,evo.to,evo.from,base.hp,base.atk,base.def,base.satk,base.sdef,base.spd,evo.mega,evo.mega_x,evo.mega_y,is_form,form_item
365,365,walrein,"Walrein swims all over in frigid seawater while crushing
icebergs with its grand, imposing tusks. Its thick layer of
blubber makes enemy attacks bounce off harmlessly.",1,1,96,トドゼルガ,Todozeruga,Todoseruga,Walrein,Walraisa,Kaimorse,Ice,Water,,,,14,1506,,364,110,80,90,95,90,65,,,,,
366,366,clamperl,"Clamperl’s pearls are exceedingly precious.
They can be more than 10 times as costly
as Shellder’s pearls.",1,1,384,パールル,Pāruru,Pearlulu,Clamperl,Perlu,Coquiperl,Water,,,,,4,525,367 368,,35,64,85,74,55,32,,,,,
367,367,huntail,"Deep seas are their habitat. According to
tradition, when Huntail wash up onshore,
something unfortunate will happen.",1,1,96,ハンテール,Hantēru,Huntail,Huntail,Aalabyss,Serpang,Water,,,,,17,270,,366,55,104,105,94,75,52,,,,,
368,368,gorebyss,"It sucks bodily fluids out of its prey. The
leftover meat sinks to the seafloor, where it
becomes food for other Pokémon.",1,1,96,サクラビス,Sakurabisu,Sakurabyss,Gorebyss,Saganabyss,Rosabyss,Water,,,,,18,226,,366,55,84,105,114,75,52,,,,,
369,369,relicanth,"The reason it hasn’t changed at all in a hundred
million years is that it’s apparently already a
perfect life-form.",1,1,96,ジーランス,Jīransu,Glanth,Relicanth,Relicanth,Relicanth,Water,Rock,,,,10,234,,,100,90,130,45,65,55,,,,,
370,370,luvdisc,"Luvdisc makes its home in coral reefs in warm
seas. It especially likes sleeping in the space
between Corsola’s branches.",1,1,96,ラブカス,Rabukasu,Lovecus,Luvdisc,Liebiskus,Lovdisc,Water,,,,,6,87,,,43,30,55,40,65,97,,,,,
371,371,bagon,"Some theories suggest that its behavior
of forcefully bashing its head into things
stimulates cells that affect its evolution.",1,1,1536,タツベイ,Tatsubei,Tatsubay,Bagon,Kindwurm,Draby,Dragon,,,,,6,421,372,,45,75,60,40,30,50,,,,,
372,372,shelgon,"Shelgon lives deep within caves. It stays shut
up in its hard shell, dreaming of the day it will
be able to fly.",1,1,384,コモルー,Komorū,Komoruu,Shelgon,Draschel,Drackhaus,Dragon,,,,,11,1105,373,371,65,95,100,60,50,50,,,,,
373,373,salamence,"Thanks to its fervent wishes, the cells in its
body finally mutated, and at last it has its
heart’s desire—wings.",1,1,96,ボーマンダ,Bōmanda,Bohmander,Salamence,Brutalanda,Drattak,Dragon,Flying,,,,15,1026,,372,95,135,80,110,80,100,10089,,,,
374,374,beldum,"If you anger it, it will do more than rampage. It
will also burst out strong magnetism, causing
nearby machines to break.",1,1,1536,ダンバル,Danbaru,Dumbber,Beldum,Tanhel,Terhal,Steel,Psychic,,,,6,952,375,,40,55,80,35,60,30,,,,,
375,375,metang,"It flies at high speeds around the skies. When it
finds its prey, Metang takes a firm grip with its
sharp claws and never lets go.",1,1,384,メタング,Metangu,Metang,Metang,Metang,Métang,Steel,Psychic,,,,12,2025,376,374,60,75,100,55,80,50,,,,,
376,376,metagross,"It analyzes its opponents with more accuracy
than a supercomputer, which enables it to
calmly back them into a corner.",1,1,96,メタグロス,Metagurosu,Metagross,Metagross,Metagross,Métalosse,Steel,Psychic,,,,16,5500,,375,80,135,130,95,90,70,10076,,,,
377,377,regirock,"Regirock’s body is composed entirely of rocks. Recently,
a study made the startling discovery that the rocks were all
unearthed from different locations.",1,1,6,レジロック,Rejirokku,Regirock,Regirock,Regirock,Regirock,Rock,,,1,,17,2300,,,80,100,200,50,100,50,,,,,
378,378,regice,"Regice cloaks itself with frigid air of -328 degrees Fahrenheit.
Things will freeze solid just by going near this Pokémon.
Its icy body is so cold, it will not melt even if it is immersed
in magma.",1,1,6,レジアイス,Rejiaisu,Regice,Regice,Regice,Regice,Ice,,,1,,18,1750,,,80,50,100,100,200,50,,,,,
379,379,registeel,"Registeel was imprisoned by people in ancient times.
The metal composing its body is thought to be a curious
substance that is not of this earth.",1,1,6,レジスチル,Rejisuchiru,Registeel,Registeel,Registeel,Registeel,Steel,,,1,,19,2050,,,80,75,150,75,150,50,,,,,
380,380,latias,"Latias is highly intelligent and capable of understanding
human speech. It is covered with a glass-like down.
The Pokémon enfolds its body with its down and refracts
light to alter its appearance.",1,1,6,ラティアス,Ratiasu,Latias,Latias,Latias,Latias,Dragon,Psychic,,1,,14,400,,,80,80,90,110,130,110,10062,,,,
381,381,latios,"Latios will only open its heart to a Trainer with a
compassionate spirit. This Pokémon can fly faster than a
jet plane by folding its forelegs to minimize air resistance.",1,1,6,ラティオス,Ratiosu,Latios,Latios,Latios,Latios,Dragon,Psychic,,1,,20,600,,,80,90,80,130,110,110,10063,,,,
382,382,kyogre,"Kyogre is said to be the personification of the sea itself.
Legends tell of its many clashes against Groudon,
as each sought to gain the power of nature.",1,1,6,カイオーガ,Kaiōga,Kyogre,Kyogre,Kyogre,Kyogre,Water,,,1,,45,3520,,,100,100,90,150,140,90,10077,,,,
383,383,groudon,"Through Primal Reversion and with nature’s full power,
it will take back its true form. It can cause magma to
erupt and expand the landmass of the world.",1,1,6,グラードン,Gurādon,Groudon,Groudon,Groudon,Groudon,Ground,,,1,,35,9500,,,100,150,140,100,90,90,10078,,,,
384,384,rayquaza,"It flies forever through the ozone layer, consuming
meteoroids for sustenance. The many meteoroids
in its body provide the energy it needs to Mega Evolve.",1,1,6,レックウザ,Rekkūza,Rayquaza,Rayquaza,Rayquaza,Rayquaza,Dragon,Flying,,1,,70,2065,,,105,150,90,150,90,95,10079,,,,
385,385,jirachi,"Jirachi will awaken from its sleep of a thousand years if you
sing to it in a voice of purity. It is said to make true any wish
that people desire.",1,1,12,ジラーチ,Jirāchi,Jirachi,Jirachi,Jirachi,Jirachi,Steel,Psychic,1,,,3,11,,,100,100,100,100,100,100,,,,,
386,386,deoxys,"Deoxys emerged from a virus that came from space. It is highly
intelligent and wields psychokinetic powers. This Pokémon
shoots lasers from the crystalline organ on its chest.",1,1,12,デオキシス,Deokishisu,Deoxys,Deoxys,Deoxys,Deoxys,Psychic,,1,,,17,608,,,50,150,50,150,50,150,,,,,
387,387,turtwig,"It undertakes photosynthesis with its body, making
oxygen. The leaf on its head wilts if it is thirsty.",1,1,512,ナエトル,Naetoru,Naetle,Turtwig,Chelast,Tortipouss,Grass,,,,,4,102,388,,55,68,64,45,55,31,,,,,
388,388,grotle,"It knows where pure water wells up. It carries fellow
Pokémon there on its back.",1,1,384,ハヤシガメ,Hayashigame,Hayashigame,Grotle,Chelcarain,Boskara,Grass,,,,,11,970,389,387,75,89,85,55,65,36,,,,,
389,389,torterra,"Small Pokémon occasionally gather on its unmoving
back to begin building their nests.",1,1,96,ドダイトス,Dodaitosu,Dodaitose,Torterra,Chelterrar,Torterra,Grass,Ground,,,,22,3100,,388,95,109,105,75,85,56,,,,,
390,390,chimchar,"The gas made in its belly burns from its rear end.
The fire burns weakly when it feels sick.",1,1,512,ヒコザル,Hikozaru,Hikozaru,Chimchar,Panflam,Ouisticram,Fire,,,,,5,62,391,,44,58,44,58,44,61,,,,,
391,391,monferno,"It uses ceilings and walls to launch aerial attacks.
Its fiery tail is but one weapon.",1,1,384,モウカザル,Mōkazaru,Moukazaru,Monferno,Panpyro,Chimpenfeu,Fire,Fighting,,,,9,220,392,390,64,78,52,78,52,81,,,,,
392,392,infernape,"It tosses its enemies around with agility. It uses all
its limbs to fight in its own unique style.",1,1,96,ゴウカザル,Gōkazaru,Goukazaru,Infernape,Panferno,Simiabraz,Fire,Fighting,,,,12,550,,391,76,104,71,104,71,108,,,,,
393,393,piplup,"Because it is very proud, it hates accepting food
from people. Its thick down guards it from cold.",1,1,512,ポッチャマ,Potchama,Pochama,Piplup,Plinfa,Tiplouf,Water,,,,,4,52,394,,53,51,53,61,56,40,,,,,
394,394,prinplup,"It lives a solitary life. Its wings deliver wicked blows
that can snap even the thickest of trees.",1,1,384,ポッタイシ,Pottaishi,Pottaishi,Prinplup,Pliprin,Prinplouf,Water,,,,,8,230,395,393,64,66,68,81,76,50,,,,,
395,395,empoleon,"The three horns that extend from its beak attest to
its power. The leader has the biggest horns.",1,1,96,エンペルト,Enperuto,Emperte,Empoleon,Impoleon,Pingoléon,Water,Steel,,,,17,845,,394,84,86,88,111,101,60,,,,,
396,396,starly,"They flock around mountains and fields, chasing
after bug Pokémon. Their singing is noisy
and annoying.",1,1,1536,ムックル,Mukkuru,Mukkuru,Starly,Staralili,Étourmi,Normal,Flying,,,,3,20,397,,40,55,30,30,30,60,,,,,
397,397,staravia,"It lives in forests and fields. Squabbles over
territory occur when flocks collide.",1,1,384,ムクバード,Mukubādo,Mukubird,Staravia,Staravia,Étourvol,Normal,Flying,,,,6,155,398,396,55,75,50,40,40,80,,,,,
398,398,staraptor,"When Staravia evolve into Staraptor, they leave the
flock to live alone. They have sturdy wings.",1,1,96,ムクホーク,Mukuhōku,Mukuhawk,Staraptor,Staraptor,Étouraptor,Normal,Flying,,,,12,249,,397,85,120,70,50,60,100,,,,,
399,399,bidoof,"It constantly gnaws on logs and rocks to whittle
down its front teeth. It nests alongside water.",1,1,384,ビッパ,Bippa,Bippa,Bidoof,Bidiza,Keunotor,Normal,,,,,5,200,400,,59,45,40,35,40,31,,,,,
400,400,bibarel,"It makes its nest by damming streams with bark and
mud. It is known as an industrious worker.",1,1,96,ビーダル,Bīdaru,Beadaru,Bibarel,Bidifas,Castorno,Normal,Water,,,,10,315,,399,79,85,60,55,60,71,,,,,
401,401,kricketot,"When its antennae hit each other, it sounds like the
music of a xylophone.",1,1,384,コロボーシ,Korobōshi,Korobohshi,Kricketot,Zirpurze,Crikzik,Bug,,,,,3,22,402,,37,25,41,25,41,25,,,,,
402,402,kricketune,"It signals its emotions with its melodies. Scientists
are studying these melodic patterns.",1,1,96,コロトック,Korotokku,Korotock,Kricketune,Zirpeise,Mélokrik,Bug,,,,,10,255,,401,77,85,51,55,51,65,,,,,
403,403,shinx,"All of its fur dazzles if danger is sensed. It flees
while the foe is momentarily blinded.",1,1,1536,コリンク,Korinku,Kolink,Shinx,Sheinux,Lixy,Electric,,,,,5,95,404,,45,65,34,40,34,45,,,,,
404,404,luxio,"Strong electricity courses through the tips of its
sharp claws. A light scratch causes fainting in foes.",1,1,384,ルクシオ,Rukushio,Luxio,Luxio,Luxio,Luxio,Electric,,,,,9,305,405,403,60,85,49,60,49,60,,,,,
405,405,luxray,"Luxray’s ability to see through objects comes in
handy when it’s scouting for danger.",1,1,96,レントラー,Rentorā,Rentorar,Luxray,Luxtra,Luxray,Electric,,,,,14,420,,404,80,120,79,95,79,70,,,,,
406,406,budew,"Over the winter, it closes its bud and endures the
cold. In spring, the bud opens and releases pollen.",1,1,96,スボミー,Subomī,Subomie,Budew,Knospi,Rozbouton,Grass,Poison,,,,2,12,315,,40,30,35,50,70,55,,,,,
407,407,roserade,"With the movements of a dancer, it strikes with
whips that are densely lined with poison thorns.",1,1,96,ロズレイド,Rozureido,Roserade,Roserade,Roserade,Roserade,Grass,Poison,,,,9,145,,315,60,70,65,125,105,90,,,,,
408,408,cranidos,"Its hard skull is its distinguishing feature. It
snapped trees by headbutting them, and then
it fed on their ripe berries.",1,1,384,ズガイドス,Zugaidosu,Zugaidos,Cranidos,Koknodon,Kranidos,Rock,,,,,9,315,409,,67,125,40,30,30,58,,,,,
409,409,rampardos,"This ancient Pokémon used headbutts skillfully.
Its brain was really small, so some theories
suggest that its stupidity led to its extinction.",1,1,96,ラムパルド,Ramuparudo,Rampald,Rampardos,Rameidon,Charkos,Rock,,,,,16,1025,,408,97,165,60,65,50,58,,,,,
410,410,shieldon,"Although its fossils can be found in layers of
primeval rock, nothing but its face has ever
been discovered.",1,1,384,タテトプス,Tatetopusu,Tatetops,Shieldon,Schilterus,Dinoclier,Rock,Steel,,,,5,570,411,,30,42,118,42,88,30,,,,,
411,411,bastiodon,"This Pokémon is from roughly 100 million years
ago. Its terrifyingly tough face is harder
than steel.",1,1,96,トリデプス,Toridepusu,Torideps,Bastiodon,Bollterus,Bastiodon,Rock,Steel,,,,13,1495,,410,60,52,168,47,138,30,,,,,
412,412,burmy,"If its cloak is broken in battle, it quickly remakes
the cloak with materials nearby.",1,1,384,ミノムッチ,Minomutchi,Minomucchi,Burmy,Burmy,Cheniti,Bug,,,,,2,34,413 414,,40,29,45,29,45,36,,,,,
413,413,wormadam,"When Burmy evolved, its cloak became a part of
this Pokémon’s body. The cloak is never shed.",1,1,96,ミノマダム,Minomadamu,Minomadam,Wormadam,Burmadame,Cheniselle,Bug,Grass,,,,5,65,,412,60,59,85,79,105,36,,,,,
414,414,mothim,"It flutters around at night and steals honey from
the Combee hive.",1,1,96,ガーメイル,Gāmeiru,Gamale,Mothim,Moterpel,Papilord,Bug,Flying,,,,9,233,,412,70,94,50,94,50,66,,,,,
415,415,combee,"It collects and delivers honey to its colony.
At night, they cluster to form a beehive and sleep.",1,1,384,ミツハニー,Mitsuhanī,Mitsuhoney,Combee,Wadribie,Apitrini,Bug,Flying,,,,3,55,416,,30,30,42,30,42,70,,,,,
416,416,vespiquen,"Its abdomen is a honeycomb for grubs. It raises its
grubs on honey collected by Combee.",1,1,96,ビークイン,Bīkuin,Beequen,Vespiquen,Honweisel,Apireine,Bug,Flying,,,,12,385,,415,70,80,102,80,102,40,,,,,
417,417,pachirisu,"A pair may be seen rubbing their cheek pouches
together in an effort to share stored electricity.",1,1,96,パチリス,Pachirisu,Pachirisu,Pachirisu,Pachirisu,Pachirisu,Electric,,,,,4,39,,,60,45,70,45,90,95,,,,,
418,418,buizel,"It inflates the flotation sac around its neck and
pokes its head out of the water to see what is
going on.",1,1,384,ブイゼル,Buizeru,Buoysel,Buizel,Bamelin,Mustébouée,Water,,,,,7,295,419,,55,65,35,60,30,85,,,,,
419,419,floatzel,"Its flotation sac developed as a result of pursuing
aquatic prey. It can double as a rubber raft.",1,1,96,フローゼル,Furōzeru,Floazel,Floatzel,Bojelin,Mustéflott,Water,,,,,11,335,,418,85,105,55,85,50,115,,,,,
420,420,cherubi,"It evolves by sucking the energy out of the small
ball where it had been storing nutrients.",1,1,384,チェリンボ,Cherinbo,Cherinbo,Cherubi,Kikugi,Ceribou,Grass,,,,,4,33,421,,45,35,45,62,53,35,,,,,
421,421,cherrim,"If it senses strong sunlight, it opens its folded
petals to absorb the sun’s rays with its whole body.",1,1,96,チェリム,Cherimu,Cherrim,Cherrim,Kinoso,Ceriflor,Grass,,,,,5,93,,420,70,60,70,87,78,85,,,,,
422,422,shellos,"When it senses danger, a purple liquid oozes out
of it. The liquid is thought to be something like
greasy sweat.",1,1,384,カラナクシ,Karanakushi,Karanakushi,Shellos,Schalellos,Sancoki,Water,,,,,3,63,423,,76,48,48,57,62,34,,,,,
423,423,gastrodon,"Their shape and color change, depending on
their environment and diet. There are many of
them at beaches where the waves are calm.",1,1,96,トリトドン,Toritodon,Tritodon,Gastrodon,Gastrodon,Tritosor,Water,Ground,,,,9,299,,422,111,83,68,92,82,39,,,,,
424,424,ambipom,"It uses its tails for everything. If it wraps both
of its tails around you and gives you a squeeze,
that’s proof it really likes you.",1,1,96,エテボース,Etebōsu,Eteboth,Ambipom,Ambidiffel,Capidextre,Normal,,,,,12,203,,190,75,100,66,60,66,115,,,,,
425,425,drifloon,"Wandering souls gathered together to form this
Pokémon. When trying to make friends with
children, Drifloon grabs them by the hand.",1,1,384,フワンテ,Fuwante,Fuwante,Drifloon,Driftlon,Baudrive,Ghost,Flying,,,,4,12,426,,90,50,34,60,44,70,,,,,
426,426,drifblim,"The raw material for the gas inside its body
is souls. When its body starts to deflate, it’s
thought to carry away people and Pokémon.",1,1,96,フワライド,Fuwaraido,Fuwaride,Drifblim,Drifzepeli,Grodrive,Ghost,Flying,,,,12,150,,425,150,80,44,90,54,80,,,,,
427,427,buneary,"The reason it keeps one ear rolled up is so it
can launch a swift counterattack if it’s attacked
by an enemy.",1,1,384,ミミロル,Mimiroru,Mimirol,Buneary,Haspiror,Laporeille,Normal,,,,,4,55,428,,55,66,44,44,56,85,,,,,
428,428,lopunny,"It’s notably wary and has a dislike of fighting,
but at the same time, it can deliver powerful
kicks with its lithe legs.",1,1,96,ミミロップ,Mimiroppu,Mimilop,Lopunny,Schlapor,Lockpin,Normal,,,,,12,333,,427,65,76,84,54,96,105,10088,,,,
429,429,mismagius,"Its muttered curses can cause awful headaches
or terrifying visions that torment others.",1,1,96,ムウマージ,Mūmāji,Mumargi,Mismagius,Traunmagil,Magirêve,Ghost,,,,,9,44,,200,60,60,60,105,105,105,,,,,
430,430,honchkrow,"Its goons take care of most of the fighting for it.
The only time it dirties its own hands is in
delivering a final blow to finish off an opponent.",1,1,96,ドンカラス,Donkarasu,Dongkarasu,Honchkrow,Kramshef,Corboss,Dark,Flying,,,,9,273,,198,100,125,52,105,52,71,,,,,
431,431,glameow,"When it’s happy, Glameow demonstrates beautiful
movements of its tail, like a dancing ribbon.",1,1,384,ニャルマー,Nyarumā,Nyarmar,Glameow,Charmian,Chaglam,Normal,,,,,5,39,432,,49,55,42,42,37,85,,,,,
432,432,purugly,"To make itself appear intimidatingly beefy, it tightly
cinches its waist with its twin tails.",1,1,96,ブニャット,Bunyatto,Bunyatto,Purugly,Shnurgarst,Chaffreux,Normal,,,,,10,438,,431,71,82,64,64,59,112,,,,,
433,433,chingling,"There is an orb inside its mouth. When it hops,
the orb bounces all over and makes a
ringing sound.",1,1,96,リーシャン,Rīshan,Lisyan,Chingling,Klingplim,Korillon,Psychic,,,,,2,6,358,,45,30,50,65,50,45,,,,,
434,434,stunky,"It protects itself by spraying a noxious fluid from its
rear. The stench lingers for 24 hours.",1,1,384,スカンプー,Sukanpū,Skunpuu,Stunky,Skunkapuh,Moufouette,Poison,Dark,,,,4,192,435,,63,63,47,41,41,74,,,,,
435,435,skuntank,"It sprays a stinky fluid from its tail. The fluid smells
worse the longer it is allowed to fester.",1,1,96,スカタンク,Sukatanku,Skutank,Skuntank,Skuntank,Moufflair,Poison,Dark,,,,10,380,,434,103,93,67,71,61,84,,,,,
436,436,bronzor,"Implements shaped like it were discovered in
ancient tombs. It is unknown if they are related.",1,1,384,ドーミラー,Dōmirā,Dohmirror,Bronzor,Bronzel,Archéomire,Steel,Psychic,,,,5,605,437,,57,24,86,24,86,23,,,,,
437,437,bronzong,"Ancient people believed that petitioning Bronzong
for rain was the way to make crops grow.",1,1,96,ドータクン,Dōtakun,Dohtakun,Bronzong,Bronzong,Archéodong,Steel,Psychic,,,,13,1870,,436,67,89,116,79,116,33,,,,,
438,438,bonsly,"If its body gets too damp, it will die. So, in a
process reminiscent of sweating, its eyes
expel moisture.",1,1,96,ウソハチ,Usohachi,Usohachi,Bonsly,Mobai,Manzaï,Rock,,,,,5,150,185,,50,80,95,10,45,10,,,,,
439,439,mime-jr,"When this gifted mimic surprises an opponent,
Mime Jr. feels so happy that it ends up
forgetting it was imitating something.",1,1,96,マネネ,Manene,Manene,Mime Jr.,Pantimimi,Mime Jr.,Psychic,Fairy,,,,6,130,122,,20,25,45,70,90,60,,,,,
440,440,happiny,"When it sees something round and white,
Happiny puts it into the pouch on its stomach. It
sometimes becomes overloaded and can’t move.",1,1,96,ピンプク,Pinpuku,Pinpuku,Happiny,Wonneira,Ptiravi,Normal,,,,,6,244,113,,100,5,5,15,65,30,,,,,
441,441,chatot,"It can learn and speak human words. If they gather,
they all learn the same saying.",1,1,96,ペラップ,Perappu,Perap,Chatot,Plaudagei,Pijako,Normal,Flying,,,,5,19,,,76,65,45,92,42,91,,,,,
442,442,spiritomb,"It was bound to a fissure in an odd keystone as
punishment for misdeeds 500 years ago.",1,1,96,ミカルゲ,Mikaruge,Mikaruge,Spiritomb,Kryppuk,Spiritomb,Ghost,Dark,,,,10,1080,,,50,92,108,92,108,35,,,,,
443,443,gible,"Its original home is an area much hotter than
Alola. If you’re planning to live with one, your
heating bill will soar.",1,1,1536,フカマル,Fukamaru,Fukamaru,Gible,Kaumalat,Griknot,Dragon,Ground,,,,7,205,444,,58,70,45,40,45,42,,,,,
444,444,gabite,"It sheds its skin and gradually grows larger. Its
scales can be ground into a powder and used
as raw materials for traditional medicine.",1,1,384,ガバイト,Gabaito,Gabite,Gabite,Knarksel,Carmache,Dragon,Ground,,,,14,560,445,443,68,90,65,50,55,82,,,,,
445,445,garchomp,"Its fine scales don’t just reduce wind
resistance—their sharp edges also cause injury
to any opponent who attacks it.",1,1,96,ガブリアス,Gaburiasu,Gaburias,Garchomp,Knakrack,Carchacrok,Dragon,Ground,,,,19,950,,444,108,130,95,80,85,102,10058,,,,
446,446,munchlax,"Anything that looks edible, Munchlax will go on
and swallow whole. Its stomach is tough enough
to handle it even if the food has gone rotten.",1,1,96,ゴンベ,Gonbe,Gonbe,Munchlax,Mampfaxo,Goinfrex,Normal,,,,,6,1050,143,,135,85,40,40,85,5,,,,,
447,447,riolu,"It uses waves called auras to communicate with
others of its kind. It doesn’t make any noise
during this time, so its enemies can’t detect it.",1,1,384,リオル,Rioru,Riolu,Riolu,Riolu,Riolu,Fighting,,,,,7,202,448,,40,70,40,35,40,60,,,,,
448,448,lucario,"Lucario reads its opponent’s feelings with its
aura waves. It finds out things it would rather
not know, so it gets stressed out easily.",1,1,96,ルカリオ,Rukario,Lucario,Lucario,Lucario,Lucario,Fighting,Steel,,,,12,540,,447,70,110,70,115,70,90,10059,,,,
449,449,hippopotas,"It enshrouds itself with sand to protect itself from
germs. It does not enjoy getting wet.",1,1,384,ヒポポタス,Hipopotasu,Hippopotas,Hippopotas,Hippopotas,Hippopotas,Ground,,,,,8,495,450,,68,72,78,38,42,32,,,,,
450,450,hippowdon,"It blasts internally stored sand from ports on its
body to create a towering twister for attack.",1,1,96,カバルドン,Kabarudon,Kabaldon,Hippowdon,Hippoterus,Hippodocus,Ground,,,,,20,3000,,449,108,112,118,68,72,47,,,,,
451,451,skorupi,"It burrows under the sand to lie in wait for prey.
Its tail claws can inject its prey with a
savage poison.",1,1,384,スコルピ,Sukorupi,Scorupi,Skorupi,Pionskora,Rapion,Poison,Bug,,,,8,120,452,,40,50,90,30,55,65,,,,,
452,452,drapion,"It has the power in its clawed arms to make scrap
of a car. The tips of its claws release poison.",1,1,96,ドラピオン,Dorapion,Dorapion,Drapion,Piondragi,Drascore,Poison,Dark,,,,13,615,,451,70,90,110,60,75,95,,,,,
453,453,croagunk,"Inflating its poison sacs, it fills the area with an odd
sound and hits flinching opponents with a
poison jab.",1,1,384,グレッグル,Guregguru,Gureggru,Croagunk,Glibunkel,Cradopaud,Poison,Fighting,,,,7,230,454,,48,61,40,61,40,50,,,,,
454,454,toxicroak,"Its knuckle claws secrete a toxin so vile that even a
scratch could prove fatal.",1,1,96,ドクロッグ,Dokuroggu,Dokurog,Toxicroak,Toxiquak,Coatox,Poison,Fighting,,,,13,444,,453,83,106,65,86,65,85,,,,,
455,455,carnivine,"It binds itself to trees in marshes. It attracts prey
with its sweet-smelling drool and gulps them down.",1,1,96,マスキッパ,Masukippa,Muskippa,Carnivine,Venuflibis,Vortente,Grass,,,,,14,270,,,74,100,72,90,72,46,,,,,
456,456,finneon,"It lures in prey with its shining tail fins. It stays
near the surface during the day and moves to
the depths when night falls.",1,1,384,ケイコウオ,Keiko'uo,Keikouo,Finneon,Finneon,Écayon,Water,,,,,4,70,457,,49,49,56,49,61,66,,,,,
457,457,lumineon,"They traverse the deep waters as if crawling
over the seafloor. The fantastic lights of its
fins shine like stars in the night sky.",1,1,96,ネオラント,Neoranto,Neolant,Lumineon,Lumineon,Luminéon,Water,,,,,12,240,,456,69,69,76,69,86,91,,,,,
458,458,mantyke,"Mantyke are friendly toward people and will
approach boats closely. The patterns on their
backs differ depending on their habitat.",1,1,96,タマンタ,Tamanta,Tamanta,Mantyke,Mantirps,Babimanta,Water,Flying,,,,10,650,226,,45,20,50,60,120,50,,,,,
459,459,snover,"In the spring, it grows berries with the texture of
frozen treats around its belly.",1,1,384,ユキカブリ,Yukikaburi,Yukikaburi,Snover,Shnebedeck,Blizzi,Grass,Ice,,,,10,505,460,,60,62,50,62,60,40,,,,,
460,460,abomasnow,"It lives a quiet life on mountains that are perpetually
covered in snow. It hides itself by whipping
up blizzards.",1,1,96,ユキノオー,Yukinoō,Yukinooh,Abomasnow,Rexblisar,Blizzaroi,Grass,Ice,,,,22,1355,,459,90,92,75,92,85,60,10060,,,,
461,461,weavile,"Thanks to its increased intelligence, scrapping
over food is a thing of the past. A scratch from
its claws will give you a case of frostbite!",1,1,96,マニューラ,Manyūra,Manyula,Weavile,Snibunna,Dimoret,Dark,Ice,,,,11,340,,215,70,120,65,45,85,125,,,,,
462,462,magnezone,"There are still people who believe that this
Pokémon came from outer space. It emanates
a powerful magnetic field.",1,1,96,ジバコイル,Jibakoiru,Jibacoil,Magnezone,Magnezone,Magnézone,Electric,Steel,,,,12,1800,,82,70,70,115,130,90,60,,,,,
463,463,lickilicky,"It uses its tongue much more skillfully than its
hands or its feet. It can deftly pick up a
single small bean with its tongue.",1,1,96,ベロベルト,Beroberuto,Berobelt,Lickilicky,Schlurplek,Coudlangue,Normal,,,,,17,1400,,108,110,85,95,80,95,50,,,,,
464,464,rhyperior,"It puts rocks in holes in its palms and uses its
muscles to shoot them. Geodude are shot at
rare times.",1,1,96,ドサイドン,Dosaidon,Dosidon,Rhyperior,Rihornior,Rhinastoc,Ground,Rock,,,,24,2828,,112,115,140,130,55,55,40,,,,,
465,465,tangrowth,"Its vines grow so profusely that, in the warm
season, you can’t even see its eyes.",1,1,96,モジャンボ,Mojanbo,Mojumbo,Tangrowth,Tangoloss,Bouldeneu,Grass,,,,,20,1286,,114,100,100,125,110,50,50,,,,,
466,466,electivire,"A single Electivire can provide enough electricity
for all the buildings in a big city for a year.",1,1,96,エレキブル,Erekiburu,Elekible,Electivire,Elevoltek,Élekable,Electric,,,,,18,1386,,125,75,123,67,95,85,95,,,,,
