id,dex_number,slug,description,enabled,catchable,abundance,name.ja,name.ja_r,name.ja_t,name.en,name.de,name.fr,type.0,type.1,mythical,legendary,ultra_beast,height,weight,evo.to,evo.from,base.hp,base.atk,base.def,base.satk,base.sdef,base.spd,evo.mega,evo.mega_x,evo.mega_y,is_form,form_item
675,675,pangoro,"Pangoro is the type to talk with its fists. It
doesn’t say much as it pummels opponents with
enough force to send a dump truck flying.",1,1,96,ゴロンダ,Goronda,Goronda,Pangoro,Pandagro,Pandarbare,Fighting,Dark,,,,21,1360,,674,95,124,78,69,71,58,,,,,
676,676,furfrou,"Left alone, its fur will grow longer and longer,
but it will only allow someone it trusts to cut it.",1,1,96,トリミアン,Torimian,Trimmien,Furfrou,Coiffwaff,Couafarel,Normal,,,,,12,280,,,75,80,60,65,90,102,,,,,
677,677,espurr,"It has enough psychic energy to blast
everything within 300 feet of itself,
but it has no control over its power.",1,1,384,ニャスパー,Nyasupā,Nyasper,Espurr,Psiau,Psystigri,Psychic,,,,,3,35,678,,62,48,54,63,60,68,,,,,
678,678,meowstic,"The eyeball patterns on the interior of its ears
emit psychic energy. It keeps the patterns tightly
covered because that power is too immense.",1,1,96,ニャオニクス,Nyaonikusu,Nyaonix,Meowstic,Psiaugon,Mistigrix,Psychic,,,,,6,85,,677,74,48,76,83,81,104,,,,,
679,679,honedge,"If anyone dares to grab its hilt, it wraps
a blue cloth around that person’s arm and
drains that person’s life energy completely.",1,1,1536,ヒトツキ,Hitotsuki,Hitotsuki,Honedge,Gramokles,Monorpale,Steel,Ghost,,,,8,20,680,,45,80,100,35,37,28,,,,,
680,680,doublade,"The complex attack patterns of its two swords
are unstoppable, even for an opponent
greatly accomplished at swordplay.",1,1,384,ニダンギル,Nidangiru,Nidangill,Doublade,Duokles,Dimoclès,Steel,Ghost,,,,8,45,681,679,59,110,150,45,49,35,,,,,
681,681,aegislash,"Apparently, it can detect the innate qualities
of leadership. According to legend, whoever it
recognizes is destined to become king.",1,1,96,ギルガルド,Girugarudo,Gillgard,Aegislash,Durengard,Exagide,Steel,Ghost,,,,17,530,,680,60,50,150,50,150,60,,,,,
682,682,spritzee,"In the past, rather than using perfume,
royal ladies carried a Spritzee
that would waft a fragrance they liked.",1,1,384,シュシュプ,Shushupu,Shushupu,Spritzee,Parfi,Fluvetin,Fairy,,,,,2,5,683,,78,52,60,63,65,23,,,,,
683,683,aromatisse,"Its scent is so overpowering that, unless a Trainer
happens to really enjoy the smell, he or she will
have a hard time walking alongside it.",1,1,96,フレフワン,Furefuwan,Frefuwan,Aromatisse,Parfinesse,Cocotine,Fairy,,,,,8,155,,682,101,72,72,99,89,29,,,,,
684,684,swirlix,"Because it eats nothing but sweets,
its fur is as sticky sweet as cotton candy.",1,1,384,ペロッパフ,Peroppafu,Peroppafu,Swirlix,Flauschling,Sucroquin,Fairy,,,,,4,35,685,,62,48,66,59,57,49,,,,,
685,685,slurpuff,"Its sense of smell is 100 million times better than
a human’s, so even the faintest scent tells it about
everything in the area. It’s like it can see with its nose!",1,1,96,ペロリーム,Perorīmu,Peroream,Slurpuff,Sabbaione,Cupcanaille,Fairy,,,,,8,50,,684,82,80,86,85,75,72,,,,,
686,686,inkay,"When exchanging information with others of its
kind, it flashes the light-emitting spots on its
body in a complex rhythm.",1,1,384,マーイーカ,Māīka,Maaiika,Inkay,Iscalar,Sepiatop,Dark,Psychic,,,,4,35,687,,53,54,53,37,46,45,,,,,
687,687,malamar,"It flashes the pattern on its torso to control its
prey and draw them in. The edges of its fins are
supremely sharp.",1,1,96,カラマネロ,Karamanero,Calamanero,Malamar,Calamanero,Sepiatroce,Dark,Psychic,,,,15,470,,686,86,92,88,68,75,73,,,,,
688,688,binacle,"They stretch and then contract, yanking their
rocks along with them in bold hops. They eat
seaweed that washes up on the shoreline.",1,1,384,カメテテ,Kametete,Kametete,Binacle,Bithora,Opermine,Rock,Water,,,,5,310,689,,42,52,67,39,56,50,,,,,
689,689,barbaracle,"Barbaracle’s legs and hands have minds
of their own, and they will move independently.
But they usually follow the head’s orders.",1,1,96,ガメノデス,Gamenodesu,Gamenodes,Barbaracle,Thanathora,Golgopathe,Rock,Water,,,,13,960,,688,72,105,115,54,86,68,,,,,
690,690,skrelp,"It’s not good at swimming, so it clings to the
seaweed. In the Alola region, it’s often found
near Dhelmise.",1,1,384,クズモー,Kuzumō,Kuzumo,Skrelp,Algitt,Venalgue,Poison,Water,,,,5,73,691,,50,60,60,60,60,30,,,,,
691,691,dragalge,"It blends in with seaweed to ambush its prey
and then takes them down with a poisonous
liquid strong enough to melt metal.",1,1,96,ドラミドロ,Doramidoro,Dramidoro,Dragalge,Tandrak,Kravarech,Poison,Dragon,,,,18,815,,690,65,75,90,97,123,44,,,,,
692,692,clauncher,"It moves around by jetting water from its right
pincer. It has a poor sense of balance, so it’s
terrible at swimming straight.",1,1,384,ウデッポウ,Udeppō,Udeppou,Clauncher,Scampisto,Flingouste,Water,,,,,5,83,693,,50,53,62,58,63,44,,,,,
693,693,clawitzer,"Its right arm is packed with meat. When its
pincer falls off, it’s exported to be used as a
cooking ingredient.",1,1,96,ブロスター,Burosutā,Bloster,Clawitzer,Wummer,Gamblast,Water,,,,,13,353,,692,71,73,88,120,89,59,,,,,
694,694,helioptile,"The frills on either side of its head have cells
that generate electricity when exposed to sunlight.",1,1,384,エリキテル,Erikiteru,Erikiteru,Helioptile,Eguana,Galvaran,Electric,Normal,,,,5,60,695,,44,38,33,61,43,70,,,,,
695,695,heliolisk,"It stimulates its muscles with electricity,
boosting the strength in its legs and enabling
it to run 100 yards in five seconds.",1,1,96,エレザード,Erezādo,Elezard,Heliolisk,Elezard,Iguolta,Electric,Normal,,,,10,210,,694,62,55,52,109,94,109,,,,,
696,696,tyrunt,"Tyrunt is spoiled and selfish. It may just be
trying to frolic, but sometimes the ones it’s
trying to frolic with are gravely injured.",1,1,384,チゴラス,Chigorasu,Chigoras,Tyrunt,Balgoras,Ptyranidur,Rock,Dragon,,,,8,260,697,,58,89,77,45,45,48,,,,,
697,697,tyrantrum,"The king of the ancient world, it can easily
crunch a car with the devastating strength
of its enormous jaws.",1,1,96,ガチゴラス,Gachigorasu,Gachigoras,Tyrantrum,Monargoras,Rexillius,Rock,Dragon,,,,25,2700,,696,82,121,119,69,59,71,,,,,
698,698,amaura,"Amaura was restored successfully, but it’s not
expected to live long because of the heat of the
current environment.",1,1,384,アマルス,Amarusu,Amarus,Amaura,Amarino,Amagara,Rock,Ice,,,,13,252,699,,77,59,50,67,63,46,,,,,
699,699,aurorus,"This usually quiet and kindly Pokémon has a
surface temperature of around
–240 degrees Fahrenheit.",1,1,96,アマルルガ,Amaruruga,Amaruruga,Aurorus,Amagarga,Dragmara,Rock,Ice,,,,27,2250,,698,123,77,72,99,92,58,,,,,
700,700,sylveon,"Sylveon wraps its ribbonlike feelers around its
Trainer’s arm because this touch enables it to
read its Trainer’s feelings.",1,1,96,ニンフィア,Ninfia,Nymphia,Sylveon,Feelinara,Nymphali,Fairy,,,,,10,235,,133,95,65,65,110,130,60,,,,,
701,701,hawlucha,"In combat, Hawlucha leaps nimbly about, taking
advantage of its opponents’ blind spots. It’s
also skilled at using superb submission holds.",1,1,96,ルチャブル,Ruchaburu,Luchabull,Hawlucha,Resladero,Brutalibré,Fighting,Flying,,,,8,215,,,78,92,75,74,63,118,,,,,
702,702,dedenne,"Its upper whiskers are sensors that survey its
surroundings. Its lower whiskers are organs
that shoot electricity.",1,1,96,デデンネ,Dedenne,Dedenne,Dedenne,Dedenne,Dedenne,Electric,Fairy,,,,2,22,,,67,58,57,81,67,101,,,,,
703,703,carbink,"To keep the jewels on their bodies free of
tarnish, packs of Carbink use their soft manes
to polish one another’s jewels.",1,1,96,メレシー,Mereshī,Melecie,Carbink,Rocara,Strassie,Rock,Fairy,,,,3,57,,,50,50,150,50,150,50,,,,,
704,704,goomy,"Its body is mostly water. If it dries out, it will
die, so it’s always sitting with perfect stillness
in the shade.",1,1,1536,ヌメラ,Numera,Numera,Goomy,Viscora,Mucuscule,Dragon,,,,,3,28,705,,45,50,35,55,75,40,,,,,
705,705,sliggoo,"Its entire body is covered with gooey mucus
that can dissolve anything. Be sure to put
gloves on if you’re going to touch it.",1,1,384,ヌメイル,Numeiru,Numeil,Sliggoo,Viscargot,Colimucus,Dragon,,,,,8,175,706,704,68,75,53,83,113,60,,,,,
706,706,goodra,"Underneath its slimy skin is a thick layer of fat,
and the combination of the two makes enemies’
attacks slide right off.",1,1,96,ヌメルゴン,Numerugon,Numelgon,Goodra,Viscogon,Muplodocus,Dragon,,,,,20,1505,,705,90,100,70,110,150,80,,,,,
707,707,klefki,"Long ago it lived in mines, but once the minerals
that make up its diet became scarcer, Klefki
began appearing in human settlements.",1,1,96,クレッフィ,Kureffi,Cleffy,Klefki,Clavion,Trousselin,Steel,Fairy,,,,2,30,,,57,80,91,80,87,75,,,,,
708,708,phantump,"An unknown spirit came to lodge in a tree
stump, creating this Pokémon. A cure-all can be
made from an infusion of its green leaves.",1,1,384,ボクレー,Bokurē,Bokurei,Phantump,Paragoni,Brocélôme,Ghost,Grass,,,,4,70,709,,43,70,48,50,60,38,,,,,
709,709,trevenant,"This Pokémon controls trees via roots
stretching from its feet, and it will attack
anyone that dares to ravage the forest.",1,1,96,オーロット,Ōrotto,Ohrot,Trevenant,Trombork,Desséliande,Ghost,Grass,,,,15,710,,708,85,110,76,65,82,56,,,,,
710,710,pumpkaboo,"It is said to carry wandering spirits
to the place where they belong
so they can move on.",1,1,384,バケッチャ,Baketcha,Bakeccha,Pumpkaboo,Irrbis,Pitrouille,Ghost,Grass,,,,4,50,711,,49,66,70,44,55,51,,,,,
711,711,gourgeist,"It enwraps its prey in its hairlike arms.
It sings joyfully as it observes the
suffering of its prey.",1,1,96,パンプジン,Panpujin,Pumpjin,Gourgeist,Pumpdjinn,Banshitrouye,Ghost,Grass,,,,9,125,,710,65,90,122,58,75,84,,,,,
712,712,bergmite,"Using air of -150 degrees Fahrenheit, they
freeze opponents solid. They live in herds
above the snow line on mountains.",1,1,384,カチコール,Kachikōru,Kachikohru,Bergmite,Arktip,Grelaçon,Ice,,,,,10,995,713,,55,69,85,32,35,28,,,,,
713,713,avalugg,"The way several Bergmite huddle
on its back makes it look like
an aircraft carrier made of ice.",1,1,96,クレベース,Kurebēsu,Crebase,Avalugg,Arktilas,Séracrawl,Ice,,,,,20,5050,,712,95,117,184,44,46,28,,,,,
714,714,noibat,"It flies around in search of fruit to eat. It uses
ultrasonic waves to detect which fruits are ripe.",1,1,384,オンバット,Onbatto,Onbat,Noibat,eF-eM,Sonistrelle,Flying,Dragon,,,,5,80,715,,40,30,35,45,40,55,,,,,
715,715,noivern,"This hot-blooded Pokémon attacks anything it
sees with ultrasonic waves that can
crush boulders.",1,1,96,オンバーン,Onbān,Onvern,Noivern,UHaFnir,Bruyverne,Flying,Dragon,,,,15,850,,714,85,70,80,97,80,123,,,,,
716,716,xerneas,"When the horns on its head shine
in seven colors, it is said to be
sharing everlasting life.",1,1,6,ゼルネアス,Zeruneasu,Xerneas,Xerneas,Xerneas,Xerneas,Fairy,,,1,,30,2150,,,126,131,95,131,98,99,,,,,
717,717,yveltal,"When its life comes to an end, it absorbs
the life energy of every living thing
and turns into a cocoon once more.",1,1,6,イベルタル,Iberutaru,Yveltal,Yveltal,Yveltal,Yveltal,Dark,Flying,,1,,58,2030,,,126,131,95,131,98,99,,,,,
718,718,zygarde,"Some say it can change to an even more
powerful form when battling those who threaten
the ecosystem.",1,1,6,ジガルデ,Jigarude,Zygarde,Zygarde,Zygarde,Zygarde,Dragon,Ground,,1,,50,3050,,,108,100,121,81,95,95,,,,,
719,719,diancie,"It can instantly create many diamonds
by compressing the carbon in the air
between its hands.",1,1,12,ディアンシー,Dianshī,Diancie,Diancie,Diancie,Diancie,Rock,Fairy,1,,,7,88,,,50,100,150,100,150,50,10075,,,,
720,720,hoopa,"It is said to be able to seize anything it desires
with its six rings and six huge arms. With its power
sealed, it is transformed into a much smaller form.",1,1,12,フーパ,Fūpa,Hoopa,Hoopa,Hoopa,Hoopa,Psychic,Ghost,1,,,5,90,,,80,110,60,150,130,70,,,,,
721,721,volcanion,"It expels its internal steam from the
arms on its back. It has enough
power to blow away a mountain.",1,1,12,ボルケニオン,Borukenion,Volcanion,Volcanion,Volcanion,Volcanion,Fire,Water,1,,,17,1950,,,80,110,120,130,90,70,,,,,
722,722,rowlet,"It feels relaxed in tight, dark places and has
been known to use its Trainer’s pocket or bag
as a nest.",1,1,512,モクロー,Mokurō,Mokuroh,Rowlet,Bauz,Brindibou,Grass,Flying,,,,3,15,723,,68,55,55,50,50,42,,,,,
723,723,dartrix,"Supremely sensitive to the presence of others,
it can detect opponents standing behind it,
flinging its sharp feathers to take them out.",1,1,384,フクスロー,Fukusurō,Fukuthrow,Dartrix,Arboretoss,Efflèche,Grass,Flying,,,,7,160,724,722,78,75,75,70,70,52,,,,,
724,724,decidueye,"Decidueye can nock and fire an arrow at an
enemy in a tenth of a second, so its battles are
decided in the blink of an eye.",1,1,96,ジュナイパー,Junaipā,Junaiper,Decidueye,Silvarro,Archéduc,Grass,Ghost,,,,16,366,,723,78,107,75,100,100,70,,,,,
725,725,litten,"Its coat regrows twice a year. When the time
comes, Litten sets its own body on fire and
burns away the old fur.",1,1,512,ニャビー,Nyabī,Nyabby,Litten,Flamiau,Flamiaou,Fire,,,,,4,43,726,,45,65,40,60,40,70,,,,,
726,726,torracat,"When its mane is standing on end, you can tell
it’s feeling good. When it isn’t feeling well, its fur
will lie down flat.",1,1,384,ニャヒート,Nyahīto,Nyaheat,Torracat,Miezunder,Matoufeu,Fire,,,,,7,250,727,725,65,85,50,80,50,90,,,,,
727,727,incineroar,"When its fighting spirit is set alight, the flames
around its waist become especially intense.",1,1,96,ガオガエン,Gaogaen,Gaogaen,Incineroar,Fuegro,Félinferno,Fire,Dark,,,,18,830,,726,95,115,90,80,90,60,,,,,
728,728,popplio,"Popplio gets on top of its bouncy water balloons
to jump higher. It’s quite the acrobatic fighter!",1,1,512,アシマリ,Ashimari,Ashimari,Popplio,Robball,Otaquin,Water,,,,,4,75,729,,50,54,54,66,56,40,,,,,
729,729,brionne,"It attacks by smacking its enemies with the
exploding water balloons that it creates.",1,1,384,オシャマリ,Oshamari,Osyamari,Brionne,Marikeck,Otarlette,Water,,,,,6,175,730,728,60,69,69,91,81,50,,,,,
730,730,primarina,"Also known as a songstress, it has a fantastical
look on moonlit nights when it leads its colony
in song.",1,1,96,アシレーヌ,Ashirēnu,Ashirene,Primarina,Primarene,Oratoria,Water,Fairy,,,,18,440,,729,80,74,74,126,116,60,,,,,
731,731,pikipek,"It may look spindly, but its neck muscles are
heavy-duty. It can peck at a tree 16 times
per second!",1,1,1536,ツツケラ,Tsutsukera,Tsutsukera,Pikipek,Peppeck,Picassaut,Normal,Flying,,,,3,12,732,,35,75,30,30,30,65,,,,,
732,732,trumbeak,"From its mouth, it fires the seeds of berries
it has eaten. The scattered seeds give rise
to new plants.",1,1,384,ケララッパ,Kerarappa,Kerarappa,Trumbeak,Trompeck,Piclairon,Normal,Flying,,,,6,148,733,731,55,85,50,40,50,75,,,,,
733,733,toucannon,"Known for forming harmonious couples, this
Pokémon is brought to wedding ceremonies as a
good luck charm.",1,1,96,ドデカバシ,Dodekabashi,Dodekabashi,Toucannon,Tukanon,Bazoucan,Normal,Flying,,,,11,260,,732,80,120,75,75,75,60,,,,,
734,734,yungoos,"Although it will eat anything, it prefers fresh
living things, so it marches down streets
in search of prey.",1,1,384,ヤングース,Yangūsu,Youngoose,Yungoos,Mangunior,Manglouton,Normal,,,,,4,60,735,,48,70,30,30,30,45,,,,,
735,735,gumshoos,"Patient by nature, this Pokémon loses control of
itself and pounces when it spots its favorite
meal—Rattata!",1,1,96,デカグース,Dekagūsu,Dekagoose,Gumshoos,Manguspektor,Argouste,Normal,,,,,7,142,,734,88,110,60,55,60,45,,,,,
736,736,grubbin,"It spits a sticky thread to stop opponents in
their tracks, and then it grabs them in its
sharp, sturdy mandibles to take them down.",1,1,1536,アゴジムシ,Agojimushi,Agojimushi,Grubbin,Mabula,Larvibule,Bug,,,,,4,44,737,,47,62,45,55,45,46,,,,,
737,737,charjabug,"Its stout shell provides excellent defense from
attacks. It uses electricity on
persistent opponents.",1,1,384,デンヂムシ,Denjimushi,Dendimushi,Charjabug,Akkup,Chrysapile,Bug,Electric,,,,5,105,738,736,57,82,95,55,75,36,,,,,
738,738,vikavolt,"Vikavolt flusters opponents with acrobatic
flying maneuvers. This creates an opening for
it to deliver an electric beam attack.",1,1,96,クワガノン,Kuwaganon,Kuwagannon,Vikavolt,Donarion,Lucanon,Bug,Electric,,,,15,450,,737,77,70,90,145,75,43,,,,,
739,739,crabrawler,"Crabrawler has been known to mistake
Exeggutor for a coconut tree and climb it. The
enraged Exeggutor shakes it off and stomps it.",1,1,384,マケンカニ,Makenkani,Makenkani,Crabrawler,Krabbox,Crabagarre,Fighting,,,,,6,70,740,,47,82,57,42,47,63,,,,,
740,740,crabominable,"Before it stops to think, it just starts pummeling.
There are records of its turning back
avalanches with a flurry of punches.",1,1,96,ケケンカニ,Kekenkani,Kekenkani,Crabominable,Krawell,Crabominable,Fighting,Ice,,,,17,1800,,739,97,132,77,62,67,43,,,,,
741,741,oricorio,"This Oricorio has drunk red nectar. If its Trainer
gives the wrong order, this passionate Pokémon
becomes fiercely angry.",1,1,96,オドリドリ,Odoridori,Odoridori,Oricorio,Choreogel,Plumeline,Fire,Flying,,,,6,34,,,75,70,70,98,70,93,,,,,889
742,742,cutiefly,"Cutiefly can pick up the auras of living things. It
skillfully reads those auras to predict its foes’
movements and make fools of them.",1,1,384,アブリー,Aburī,Abuly,Cutiefly,Wommel,Bombydou,Bug,Fairy,,,,1,2,743,,40,45,40,55,40,84,,,,,
743,743,ribombee,"It can predict the weather from moisture levels
and wind direction. Ribombee only reveals itself
when there are a few clear days in a row.",1,1,96,アブリボン,Aburibon,Aburibbon,Ribombee,Bandelby,Rubombelle,Bug,Fairy,,,,2,5,,742,60,55,60,95,70,124,,,,,
744,744,rockruff,"When it rubs the rocks on its neck against you,
that’s proof of its love for you. However, the
rocks are sharp, so the gesture is quite painful!",1,1,384,イワンコ,Iwanko,Iwanko,Rockruff,Wuffels,Rocabot,Rock,,,,,5,92,745,,45,65,40,30,40,60,,,,,
745,745,lycanroc,"The rocks in its mane are sharper than a knife.
Fragments that break off are treasured as
good luck charms.",1,1,96,ルガルガン,Rugarugan,Lugarugan,Lycanroc,Wolwerock,Lougaroc,Rock,,,,,8,250,,744,75,115,65,55,65,112,,,,,
746,746,wishiwashi,"When it’s in a jam, its shining eyes attract
others of its kind. The light from its eyes is
visible almost 25 miles away.",1,1,96,ヨワシ,Yowashi,Yowashi,Wishiwashi,Lusardin,Froussardine,Water,,,,,2,3,,,45,20,20,25,25,40,,,,,
747,747,mareanie,"Aside from its head, its body parts
regenerate quickly if they’re cut off. After a
good night’s sleep, Mareanie is back to normal.",1,1,384,ヒドイデ,Hidoide,Hidoide,Mareanie,Garstella,Vorastérie,Poison,Water,,,,4,80,748,,50,53,62,43,52,45,,,,,
748,748,toxapex,"With its 12 legs, it creates a dome to shelter
within. The flow of the tides doesn’t affect
Toxapex in there, so it’s very comfortable.",1,1,96,ドヒドイデ,Dohidoide,Dohidoide,Toxapex,Aggrostella,Prédastérie,Poison,Water,,,,7,145,,747,50,63,152,53,142,35,,,,,
749,749,mudbray,"Possessing mighty power, Mudbray can be
loaded with 50 times its own body weight
and will be totally fine.",1,1,384,ドロバンコ,Dorobanko,Dorobanko,Mudbray,Pampuli,Tiboudet,Ground,,,,,10,1100,750,,70,100,70,45,55,45,,,,,
750,750,mudsdale,"It can trudge mountain roads without rest
for three days and three nights, all the while
dragging a 10-ton load.",1,1,96,バンバドロ,Banbadoro,Banbadoro,Mudsdale,Pampross,Bourrinos,Ground,,,,,25,9200,,749,100,125,100,55,85,35,,,,,
751,751,dewpider,"It can only breathe oxygen that has dissolved in
water, so it wears a water bubble on its head
when it walks around on land.",1,1,384,シズクモ,Shizukumo,Shizukumo,Dewpider,Araqua,Araqua,Water,Bug,,,,3,40,752,,38,40,52,40,72,27,,,,,
752,752,araquanid,"It has a habit of storing things it values in its
water bubble. If its Trainer doesn’t watch out,
Araquanid will try to put them in its bubble!",1,1,96,オニシズクモ,Onishizukumo,Onishizukumo,Araquanid,Aranestro,Tarenbulle,Water,Bug,,,,18,820,,751,68,70,92,50,132,42,,,,,
753,753,fomantis,"It loves the sunshine. When it basks in the
sunlight regularly, it grows up with
vivid coloration.",1,1,384,カリキリ,Karikiri,Karikiri,Fomantis,Imantis,Mimantis,Grass,,,,,3,15,754,,40,55,35,50,35,35,,,,,
754,754,lurantis,"As it slashes into its enemies, it looks like it’s
dancing. Its elegant appearance has led some
to call it the most glamorous Grass Pokémon.",1,1,96,ラランテス,Rarantesu,Lalantes,Lurantis,Mantidea,Floramantis,Grass,,,,,9,185,,753,70,105,90,80,90,45,,,,,
755,755,morelull,"It likes damp dark places. When night falls, the
spores filling the caps of its mushrooms glow.",1,1,384,ネマシュ,Nemashu,Nemasyu,Morelull,Bubungus,Spododo,Grass,Fairy,,,,2,15,756,,40,35,55,65,75,15,,,,,
756,756,shiinotic,"When it starts fighting for territory with
Parasect, the entire area gets completely
coated in spores!",1,1,96,マシェード,Mashēdo,Mashade,Shiinotic,Lamellux,Lampignon,Grass,Fairy,,,,10,115,,755,60,45,80,90,100,30,,,,,
757,757,salandit,"It weakens opponents and sends them
reeling with its poisonous gas. Salandit doesn’t
deal well with Spinda, since it’s always reeling.",1,1,384,ヤトウモリ,Yatōmori,Yatoumori,Salandit,Molunk,Tritox,Poison,Fire,,,,6,48,758,,48,44,40,71,40,77,,,,,
758,758,salazzle,"It punishes Salandit that couldn’t bring it food
with a fierce slap of its flame-spewing palm.",1,1,96,エンニュート,Ennyūto,Ennewt,Salazzle,Amfira,Malamandre,Poison,Fire,,,,12,222,,757,68,64,60,111,60,117,,,,,
759,759,stufful,"Stufful hates to be hugged or touched in any
way. It will squirm, thrash, and resist with
amazing power.",1,1,384,ヌイコグマ,Nuikoguma,Nuikoguma,Stufful,Velursi,Nounourson,Normal,Fighting,,,,5,68,760,,70,75,50,45,50,50,,,,,
760,760,bewear,"It boasts tremendous physical strength. Many
people call it the most dangerous Pokémon in
the Alola region.",1,1,96,キテルグマ,Kiteruguma,Kiteruguma,Bewear,Kosturso,Chelours,Normal,Fighting,,,,21,1350,,759,120,125,80,55,60,60,,,,,
761,761,bounsweet,"It tries to resist being swallowed by a bird
Pokémon by spinning the sepals on its head.
It’s usually a fruitless attempt.",1,1,1536,アマカジ,Amakaji,Amakaji,Bounsweet,Frubberl,Croquine,Grass,,,,,3,32,762,,42,30,38,30,38,32,,,,,
762,762,steenee,"It bounces around, swinging the sepals on its
head with abandon. They’re quite painful when
they smack you!",1,1,384,アママイコ,Amamaiko,Amamaiko,Steenee,Frubaila,Candine,Grass,,,,,7,82,763,761,52,40,48,40,48,62,,,,,
763,763,tsareena,"A Pokémon with an aggressive personality and
a mastery of kicking, it cackles every time it
kicks an opponent.",1,1,96,アマージョ,Amājo,Amajo,Tsareena,Fruyal,Sucreine,Grass,,,,,12,214,,762,72,120,98,50,98,72,,,,,
764,764,comfey,"It picks flowers and sticks them to its body
with fluids it produces. The aroma that wafts
from its petals has a healing effect.",1,1,96,キュワワー,Kyuwawā,Cuwawa,Comfey,Curelei,Guérilande,Fairy,,,,,1,3,,,51,52,90,82,110,100,,,,,
765,765,oranguru,"Oranguru don’t get along with each other, so
they’re always engaging in battles of wits to
decide which one is superior.",1,1,96,ヤレユータン,Yareyūtan,Yareyuutan,Oranguru,Kommandutan,Gouroutan,Normal,Psychic,,,,15,760,,,90,60,80,90,110,60,,,,,
766,766,passimian,"Berries are its weapons as well as the staple of
its diet. The one that can throw a berry the
farthest is the boss of the troop.",1,1,96,ナゲツケサル,Nagetsukesaru,Nagetukesaru,Passimian,Quartermak,Quartermac,Fighting,,,,,20,828,,,100,120,90,40,60,80,,,,,
767,767,wimpod,"An astonishingly cowardly Pokémon, Wimpod
will whir its legs at high speeds to run away if
anything comes near it.",1,1,384,コソクムシ,Kosokumushi,Kosokumushi,Wimpod,Reißlaus,Sovkipou,Bug,Water,,,,5,120,768,,25,35,40,20,30,80,,,,,
768,768,golisopod,"Its claws, which it can extend and retract at
will, are its greatest weapons. Golisopod is
sometimes accompanied by Wimpod.",1,1,96,グソクムシャ,Gusokumusha,Gusokumusha,Golisopod,Tectass,Sarmuraï,Bug,Water,,,,20,1080,,767,75,125,140,60,90,40,,,,,
769,769,sandygast,"If you build sand mounds when you’re playing,
destroy them before you go home, or they
may get possessed and become Sandygast.",1,1,384,スナバァ,Sunabā,Sunaba,Sandygast,Sankabuh,Bacabouh,Ghost,Ground,,,,5,700,770,,55,55,80,70,45,15,,,,,
770,770,palossand,"Once it has whipped up a sandstorm to halt
its opponents in their tracks, this terrifying
Pokémon snatches away their vitality.",1,1,96,シロデスナ,Shirodesuna,Sirodethna,Palossand,Colossand,Trépassable,Ghost,Ground,,,,13,2500,,769,85,75,110,100,75,35,,,,,
771,771,pyukumuku,"Its entire body is covered in its own slime. If you
accidentally step on one, you’ll slip, and it will
get mad and smack you!",1,1,96,ナマコブシ,Namakobushi,Namakobushi,Pyukumuku,Gufa,Concombaffe,Water,,,,,3,12,,,55,60,130,30,130,5,,,,,
772,772,type-null,"There’s danger of its going on a rampage, so its
true power is sealed away beneath its
control mask.",1,1,6,タイプ：ヌル,Taipu:Nuru,Type: Null,Type: Null,Typ:Null,Type:0,Normal,,,1,,19,1205,773,,95,95,95,95,95,59,,,,,
773,773,silvally,"Through the bond it formed with its Trainer, its
will was strengthened, and it was able to
destroy its control mask.",1,1,6,シルヴァディ,Shiruvadi,Silvady,Silvally,Amigento,Silvallié,Normal,,,1,,23,1005,,772,95,95,95,95,95,95,,,,,
774,774,minior,"Although its outer shell is uncommonly durable,
the shock of falling to the ground smashes the
shell to smithereens.",1,1,96,メテノ,Meteno,Meteno,Minior,Meteno,Météno,Rock,Flying,,,,3,400,,,60,60,100,60,100,60,,,,,
