id,dex_number,slug,description,enabled,catchable,abundance,name.ja,name.ja_r,name.ja_t,name.en,name.de,name.fr,type.0,type.1,mythical,legendary,ultra_beast,height,weight,evo.to,evo.from,base.hp,base.atk,base.def,base.satk,base.sdef,base.spd,evo.mega,evo.mega_x,evo.mega_y,is_form,form_item
187,187,hoppip,"This Pokémon drifts and floats with the wind. If it senses the
approach of strong winds, Hoppip links its leaves with other
Hoppip to prepare against being blown away.",1,1,1536,ハネッコ,Hanekko,Hanecco,Hoppip,Hoppspross,Granivol,Grass,Flying,,,,4,5,188,,35,35,40,35,55,50,,,,,
188,188,skiploom,"Skiploom’s flower blossoms when the temperature rises
above 64 degrees Fahrenheit. How much the flower opens
depends on the temperature. For that reason, this Pokémon
is sometimes used as a thermometer.",1,1,384,ポポッコ,Popokko,Popocco,Skiploom,Hubelupf,Floravol,Grass,Flying,,,,6,10,189,187,55,45,50,45,65,80,,,,,
189,189,jumpluff,"Jumpluff rides warm southern winds to cross the sea and fly to
foreign lands. The Pokémon descends to the ground when it
encounters cold air while it is floating.",1,1,96,ワタッコ,Watakko,Watacco,Jumpluff,Papungha,Cotovol,Grass,Flying,,,,8,30,,188,75,55,70,55,95,110,,,,,
190,190,aipom,"It searches for prey from the tops of trees.
When it spots its favorite food, Bounsweet,
Aipom gets excited and pounces.",1,1,384,エイパム,Eipamu,Eipam,Aipom,Griffel,Capumain,Normal,,,,,8,115,424,,55,70,55,40,55,85,,,,,
191,191,sunkern,"Sunkern tries to move as little as it possibly can. It does so
because it tries to conserve all the nutrients it has stored in its
body for its evolution. It will not eat a thing, subsisting only on
morning dew.",1,1,384,ヒマナッツ,Himanattsu,Himanuts,Sunkern,Sonnkern,Tournegrin,Grass,,,,,3,18,192,,30,30,30,30,30,30,,,,,
192,192,sunflora,"Sunflora converts solar energy into nutrition. It moves around
actively in the daytime when it is warm. It stops moving as
soon as the sun goes down for the night.",1,1,96,キマワリ,Kimawari,Kimawari,Sunflora,Sonnflora,Héliatronc,Grass,,,,,8,85,,191,75,75,55,105,85,30,,,,,
193,193,yanma,"Yanma is capable of seeing 360 degrees without having to
move its eyes. It is a great flier that is adept at making sudden
stops and turning midair. This Pokémon uses its flying ability
to quickly chase down targeted prey.",1,1,384,ヤンヤンマ,Yan'yanma,Yanyanma,Yanma,Yanma,Yanma,Bug,Flying,,,,12,380,469,,65,65,45,75,45,95,,,,,
194,194,wooper,"Wooper usually lives in water. However, it occasionally comes
out onto land in search of food. On land, it coats its body with
a gooey, toxic film.",1,1,384,ウパー,Upā,Upah,Wooper,Felino,Axoloto,Water,Ground,,,,4,85,195,,55,45,45,25,25,15,,,,,
195,195,quagsire,"Quagsire hunts for food by leaving its mouth wide open in
water and waiting for its prey to blunder in unaware. Because
the Pokémon does not move, it does not get very hungry.",1,1,96,ヌオー,Nuō,Nuoh,Quagsire,Morlord,Maraiste,Water,Ground,,,,14,750,,194,95,85,85,65,65,35,,,,,
196,196,espeon,"Psychic power builds up in the orb on its
forehead as it bathes in the sunshine. Espeon is
not good at battling at night.",1,1,96,エーフィ,Ēfi,Eifie,Espeon,Psiana,Mentali,Psychic,,,,,9,265,,133,65,65,60,130,95,110,,,,,
197,197,umbreon,"It lurks in the dark of night looking for prey.
At the moment it pounces, the rings on its
body glow dimly but ominously.",1,1,96,ブラッキー,Burakkī,Blacky,Umbreon,Nachtara,Noctali,Dark,,,,,10,270,,133,95,65,110,60,130,65,,,,,
198,198,murkrow,"It searches for shiny things for its boss.
Murkrow’s presence is said to be unlucky, so
many people detest it.",1,1,384,ヤミカラス,Yamikarasu,Yamikarasu,Murkrow,Kramurx,Cornèbre,Dark,Flying,,,,5,21,430,,60,85,42,85,42,91,,,,,
199,199,slowking,"It’s called “the sage of the sea.” It engages in
battles of wits with Oranguru, but the result is
usually a draw.",1,1,96,ヤドキング,Yadokingu,Yadoking,Slowking,Laschoking,Roigada,Water,Psychic,,,,20,795,,79,95,75,80,100,110,30,,,,,
200,200,misdreavus,"What makes it happy is imitating the voices of
weeping people and scaring everyone. It doesn’t
deal well with folks who aren’t easily frightened.",1,1,384,ムウマ,Mūma,Muma,Misdreavus,Traunfugil,Feuforêve,Ghost,,,,,7,10,429,,60,60,60,85,85,85,,,,,
201,201,unown,"This Pokémon is shaped like ancient writing. It is a mystery as
to which came first, the ancient writings or the various Unown.
Research into this topic is ongoing but nothing is known.",1,1,96,アンノーン,Annōn,Unknown,Unown,Icognito,Zarbi,Psychic,,,,,5,50,,,48,72,48,72,48,48,,,,,
202,202,wobbuffet,"Wobbuffet does nothing but endure attacks—it won’t attack on
its own. However, it won’t endure an attack on its tail. When
that happens, the Pokémon will try to take the foe with it using
Destiny Bond.",1,1,96,ソーナンス,Sōnansu,Sonans,Wobbuffet,Woingenau,Qulbutoké,Psychic,,,,,13,285,,360,190,33,58,33,58,33,,,,,
203,203,girafarig,"Girafarig’s rear head contains a tiny brain that is too small for
thinking. However, the rear head doesn’t need to sleep, so it
can keep watch over its surroundings 24 hours a day.",1,1,96,キリンリキ,Kirinriki,Kirinriki,Girafarig,Girafarig,Girafarig,Normal,Psychic,,,,15,415,,,70,80,65,90,65,85,,,,,
204,204,pineco,"It sticks tree bark to itself with its saliva,
making itself thicker and larger. Elderly Pineco
are ridiculously huge.",1,1,384,クヌギダマ,Kunugidama,Kunugidama,Pineco,Tannza,Pomdepik,Bug,,,,,6,72,205,,50,65,90,35,35,15,,,,,
205,205,forretress,"In the moment that it gulps down its prey, the
inside of its shell is exposed, but to this day,
no one has ever seen that sight.",1,1,96,フォレトス,Foretosu,Foretos,Forretress,Forstellka,Foretress,Bug,Steel,,,,12,1258,,204,75,90,140,60,60,40,,,,,
206,206,dunsparce,"When it sees a person, it digs a hole with its tail
to make its escape. If you happen to find one,
consider yourself lucky.",1,1,96,ノコッチ,Nokotchi,Nokocchi,Dunsparce,Dummisel,Insolourdo,Normal,,,,,15,140,,,100,70,70,65,65,45,,,,,
207,207,gligar,"Gligar glides through the air without a sound as if it were
sliding. This Pokémon hangs on to the face of its foe using
its clawed hind legs and the large pincers on its forelegs, then
injects the prey with its poison barb.",1,1,384,グライガー,Guraigā,Gliger,Gligar,Skorgla,Scorplane,Ground,Flying,,,,11,648,472,,65,75,105,35,65,85,,,,,
208,208,steelix,"Steelix lives even further underground than Onix.
This Pokémon is known to dig toward the earth’s core.
There are records of this Pokémon reaching a depth of
over six-tenths of a mile underground.",1,1,96,ハガネール,Haganēru,Haganeil,Steelix,Stahlos,Steelix,Steel,Ground,,,,92,4000,,95,75,85,200,55,65,30,10072,,,,
209,209,snubbull,"In contrast to its appearance, it’s quite
timid. When playing with other puppy
Pokémon, it sometimes gets bullied.",1,1,384,ブルー,Burū,Bulu,Snubbull,Snubbull,Snubbull,Fairy,,,,,6,78,210,,60,80,50,40,40,30,,,,,
210,210,granbull,"Although it’s popular with young people,
Granbull is timid and sensitive, so it’s totally
incompetent as a watchdog.",1,1,96,グランブル,Guranburu,Granbulu,Granbull,Granbull,Granbull,Fairy,,,,,14,487,,209,90,120,75,60,60,45,,,,,
211,211,qwilfish,"Qwilfish sucks in water, inflating itself. This Pokémon
uses the pressure of the water it swallowed to shoot toxic
quills all at once from all over its body. It finds swimming
somewhat challenging.",1,1,96,ハリーセン,Harīsen,Harysen,Qwilfish,Baldorfish,Qwilfish,Water,Poison,,,,5,39,,,65,95,85,55,55,85,,,,,
212,212,scizor,"Once it has identified something as an enemy, it
will continue beating them with its steel-hard
pincers until there’s nothing left but scraps.",1,1,96,ハッサム,Hassamu,Hassam,Scizor,Scherox,Cizayox,Bug,Steel,,,,18,1180,,123,70,130,100,55,80,65,10046,,,,
213,213,shuckle,"Shuckle quietly hides itself under rocks, keeping its body
concealed inside its hard shell while eating berries it has
stored away. The berries mix with its body fluids to become
a juice.",1,1,96,ツボツボ,Tsubotsubo,Tsubotsubo,Shuckle,Pottrott,Caratroc,Bug,Rock,,,,6,205,,,20,10,230,10,230,5,,,,,
214,214,heracross,"It roams through forests searching for sweet
nectar. Although it boasts fantastic physical
strength, it’s not that good at flying.",1,1,96,ヘラクロス,Herakurosu,Heracros,Heracross,Skaraborn,Scarhino,Bug,Fighting,,,,15,540,,,80,125,75,40,95,85,10047,,,,
215,215,sneasel,"It blends into the dark of night to ambush its
prey. Sneasel will attack Sandshrew, but its
hard skin can cause Sneasel’s claws to snap off.",1,1,384,ニューラ,Nyūra,Nyula,Sneasel,Sniebel,Farfuret,Dark,Ice,,,,9,280,461,,55,95,55,35,75,115,,,,,
216,216,teddiursa,"This Pokémon likes to lick its palms that are sweetened by
being soaked in honey. Teddiursa concocts its own honey
by blending fruits and pollen collected by Beedrill.",1,1,384,ヒメグマ,Himeguma,Himeguma,Teddiursa,Teddiursa,Teddiursa,Normal,,,,,6,88,217,,60,80,50,50,50,40,,,,,
217,217,ursaring,"In the forests inhabited by Ursaring, it is said that there are
many streams and towering trees where they gather food. This
Pokémon walks through its forest gathering food every day.",1,1,96,リングマ,Ringuma,Ringuma,Ursaring,Ursaring,Ursaring,Normal,,,,,18,1258,,216,90,130,75,75,75,55,,,,,
218,218,slugma,"Slugma does not have any blood in its body. Instead, intensely
hot magma circulates throughout this Pokémon’s body,
carrying essential nutrients and oxygen to its organs.",1,1,384,マグマッグ,Magumaggu,Magmag,Slugma,Schneckmag,Limagma,Fire,,,,,7,350,219,,40,40,40,70,40,20,,,,,
219,219,magcargo,"Magcargo’s body temperature is approximately
18,000 degrees Fahrenheit. Water is vaporized on contact.
If this Pokémon is caught in the rain, the raindrops instantly
turn into steam, cloaking the area in a thick fog.",1,1,96,マグカルゴ,Magukarugo,Magcargot,Magcargo,Magcargo,Volcaropod,Fire,Rock,,,,8,550,,218,60,50,120,90,80,30,,,,,
220,220,swinub,"Swinub roots for food by rubbing its snout against the ground.
Its favorite food is a mushroom that grows under the cover of
dead grass. This Pokémon occasionally roots out hot springs.",1,1,1536,ウリムー,Urimū,Urimoo,Swinub,Quiekel,Marcacrin,Ice,Ground,,,,4,65,221,,50,50,40,30,30,50,,,,,
221,221,piloswine,"Piloswine is covered by a thick coat of long hair that enables
it to endure the freezing cold. This Pokémon uses its tusks to
dig up food that has been buried under ice.",1,1,384,イノムー,Inomū,Inomoo,Piloswine,Keifel,Cochignon,Ice,Ground,,,,11,558,473,220,100,100,80,60,60,50,,,,,
222,222,corsola,"In Alola, where their natural enemies Mareanie
are plentiful, many Corsola have stubby
branches on their heads.",1,1,96,サニーゴ,Sanīgo,Sunnygo,Corsola,Corasonn,Corayon,Water,Rock,,,,6,50,,,65,55,95,65,95,35,,,,,
223,223,remoraid,"Also known as the “sniper of the seas,”
its water gun can hit prey without fail from
over 300 feet away.",1,1,384,テッポウオ,Teppouo,Teppouo,Remoraid,Remoraid,Rémoraid,Water,,,,,6,120,224,,35,65,35,65,35,65,,,,,
224,224,octillery,"It usually sleeps in caves. The pitch-black ink
that Octillery spits is also used for cooking.",1,1,96,オクタン,Okutan,Okutank,Octillery,Octillery,Octillery,Water,,,,,9,285,,223,75,105,75,105,75,45,,,,,
225,225,delibird,"It wraps food in its tail to carry it around.
The Delibird with the biggest tail is the boss
of the flock!",1,1,96,デリバード,Deribādo,Delibird,Delibird,Botogel,Cadoizo,Ice,Flying,,,,9,160,,,45,55,45,65,45,75,,,,,
226,226,mantine,"Many people have taken up surfing because
they admire how magnificently Mantine swims.",1,1,96,マンタイン,Mantain,Mantain,Mantine,Mantax,Démanta,Water,Flying,,,,21,2200,,458,85,40,70,80,140,70,,,,,
227,227,skarmory,"Its body is draped in steel armor. It looks heavy,
but it can fly at speeds of up to 185 miles
an hour!",1,1,96,エアームド,Eāmudo,Airmd,Skarmory,Panzaeron,Airmure,Steel,Flying,,,,17,505,,,65,80,140,40,70,70,,,,,
228,228,houndour,"They make repeated eerie howls before dawn
to call attention to their pack.",1,1,384,デルビル,Derubiru,Delvil,Houndour,Hunduster,Malosse,Dark,Fire,,,,6,108,229,,45,60,30,80,50,65,,,,,
229,229,houndoom,"Identifiable by its eerie howls, people a long
time ago thought it was the grim reaper and
feared it.",1,1,96,ヘルガー,Herugā,Hellgar,Houndoom,Hundemon,Démolosse,Dark,Fire,,,,14,350,,228,75,90,50,110,80,95,10048,,,,
230,230,kingdra,"Kingdra sleeps on the seafloor where it is otherwise devoid
of life. When a storm arrives, the Pokémon is said to awaken
and wander about in search of prey.",1,1,96,キングドラ,Kingudora,Kingdra,Kingdra,Seedraking,Hyporoi,Water,Dragon,,,,18,1520,,117,75,95,95,95,95,85,,,,,
231,231,phanpy,"Phanpy uses its long nose to shower itself. When others
gather around, they thoroughly douse each other with water.
These Pokémon can be seen drying their soaking-wet
bodies at the edge of water.",1,1,384,ゴマゾウ,Gomazō,Gomazou,Phanpy,Phanpy,Phanpy,Ground,,,,,5,335,232,,90,60,60,40,40,40,,,,,
232,232,donphan,"If Donphan were to tackle with its hard body, even a house
could be destroyed. Using its massive strength, the Pokémon
helps clear rock and mud slides that block mountain trails.",1,1,96,ドンファン,Donfan,Donfan,Donphan,Donphan,Donphan,Ground,,,,,11,1200,,231,90,120,120,60,60,50,,,,,
233,233,porygon2,"Even though it doesn’t die in the vacuum of
space, it can’t move around very well in
zero gravity.",1,1,384,ポリゴン２,Porigon Tsū,Porygon2,Porygon2,Porygon2,Porygon2,Normal,,,,,6,325,474,137,85,80,90,105,95,60,,,,,
234,234,stantler,"Stantler’s magnificent antlers were traded at high prices as
works of art. As a result, this Pokémon was hunted close to
extinction by those who were after the priceless antlers.",1,1,96,オドシシ,Odoshishi,Odoshishi,Stantler,Damhirplex,Cerfrousse,Normal,,,,,14,712,,,73,95,62,85,65,85,,,,,
235,235,smeargle,"It draws symbols with the fluid that oozes from
the tip of its tail. Depending on the symbol,
Smeargle fanatics will pay big money for them.",1,1,96,ドーブル,Dōburu,Doble,Smeargle,Farbeagle,Queulorior,Normal,,,,,12,580,,,55,20,35,20,45,75,,,,,
236,236,tyrogue,"Tyrogue becomes stressed out if it does not get to train every
day. When raising this Pokémon, the Trainer must establish
and uphold various training methods.",1,1,384,バルキー,Barukī,Balkie,Tyrogue,Rabauz,Debugant,Fighting,,,,,7,210,106 107 237,,35,35,35,35,35,35,,,,,
237,237,hitmontop,"Hitmontop spins on its head at high speed, all the while
delivering kicks. This technique is a remarkable mix of both
offense and defense at the same time. The Pokémon travels
faster spinning than it does walking.",1,1,96,カポエラー,Kapoerā,Kapoerer,Hitmontop,Kapoera,Kapoera,Fighting,,,,,14,480,,236,50,95,95,35,110,70,,,,,
238,238,smoochum,"Highly perceptive sensors, Smoochum’s lips are
kept moist by its daily application of tree sap.",1,1,96,ムチュール,Muchūru,Muchul,Smoochum,Kussilla,Lippouti,Ice,Psychic,,,,4,60,124,,45,30,15,85,65,65,,,,,
239,239,elekid,"When its horns shine a bluish white, that’s the
sign it’s fully charged. You’ll get a shocking
jolt if you touch it!",1,1,96,エレキッド,Erekiddo,Elekid,Elekid,Elekid,Élekid,Electric,,,,,6,235,125,,45,63,37,65,55,95,,,,,
240,240,magby,"Its body temperature is always around 1,100
degrees Fahrenheit. If Magby falls into a small-
enough pond, the whole thing will dry up.",1,1,96,ブビィ,Bubī,Buby,Magby,Magby,Magby,Fire,,,,,7,214,126,,45,75,37,70,55,83,,,,,
241,241,miltank,"Its milk is delicious and chock-full of nutrients.
However, if you drink too much, it could make
your stomach hurt, so be careful.",1,1,96,ミルタンク,Mirutanku,Miltank,Miltank,Miltank,Écrémeuh,Normal,,,,,12,755,,,95,80,105,40,70,100,,,,,
242,242,blissey,"This Pokémon is overflowing with love. Only
Chansey that share a strong bond with their
Trainer can evolve, so people say.",1,1,96,ハピナス,Hapinasu,Happinas,Blissey,Heiteira,Leuphorie,Normal,,,,,15,468,,113,255,10,10,75,135,55,,,,,
243,243,raikou,"Raikou embodies the speed of lightning. The roars of
this Pokémon send shock waves shuddering through the
air and shake the ground as if lightning bolts had come
crashing down.",1,1,6,ライコウ,Raikō,Raikou,Raikou,Raikou,Raikou,Electric,,,1,,19,1780,,,90,85,75,115,100,115,,,,,
244,244,entei,"Entei embodies the passion of magma. This Pokémon is
thought to have been born in the eruption of a volcano.
It sends up massive bursts of fire that utterly consume all
that they touch.",1,1,6,エンテイ,Entei,Entei,Entei,Entei,Entei,Fire,,,1,,21,1980,,,115,115,85,90,75,100,,,,,
245,245,suicune,"Suicune embodies the compassion of a pure spring of water.
It runs across the land with gracefulness. This Pokémon has
the power to purify dirty water.",1,1,6,スイクン,Suikun,Suicune,Suicune,Suicune,Suicune,Water,,,1,,20,1870,,,100,75,115,90,115,85,,,,,
246,246,larvitar,"Raised on nutrients it finds in the dirt, it eats
roughly a mountain’s worth of dirt before
it becomes a pupa.",1,1,1536,ヨーギラス,Yōgirasu,Yogiras,Larvitar,Larvitar,Embrylex,Rock,Ground,,,,6,720,247,,50,64,50,45,50,41,,,,,
247,247,pupitar,"This dangerous pupa thrashes about. Its shell is
as hard as bedrock, containing its gradually
forming new body within.",1,1,384,サナギラス,Sanagirasu,Sanagiras,Pupitar,Pupitar,Ymphect,Rock,Ground,,,,12,1520,248,246,70,84,70,65,70,51,,,,,
248,248,tyranitar,"This Pokémon is a mobile disaster, leaving
mountains crumbled and houses destroyed in
its wake.",1,1,96,バンギラス,Bangirasu,Bangiras,Tyranitar,Despotar,Tyranocif,Rock,Dark,,,,20,2020,,247,100,134,110,95,100,61,10049,,,,
249,249,lugia,"Lugia’s wings pack devastating power—a light fluttering of its
wings can blow apart regular houses. As a result, this
Pokémon chooses to live out of sight deep under the sea.",1,1,6,ルギア,Rugia,Lugia,Lugia,Lugia,Lugia,Psychic,Flying,,1,,52,2160,,,106,90,130,90,154,110,,,,,
250,250,ho-oh,"Ho-Oh’s feathers glow in seven colors depending on the angle
at which they are struck by light. These feathers are said to
bring happiness to the bearers. This Pokémon is said to live at
the foot of a rainbow.",1,1,6,ホウオウ,Hōō,Houou,Ho-Oh,Ho-Oh,Ho-Oh,Fire,Flying,,1,,38,1990,,,106,130,90,110,154,90,,,,,
251,251,celebi,"This Pokémon came from the future by crossing over time.
It is thought that so long as Celebi appears, a bright and
shining future awaits us.",1,1,12,セレビィ,Serebī,Celebi,Celebi,Celebi,Celebi,Psychic,Grass,1,,,6,50,,,100,100,100,100,100,100,,,,,
252,252,treecko,"Treecko is cool, calm, and collected—it never panics under
any situation. If a bigger foe were to glare at this Pokémon,
it would glare right back without conceding an inch of ground.",1,1,512,キモリ,Kimori,Kimori,Treecko,Geckarbor,Arcko,Grass,,,,,5,50,253,,40,45,35,65,55,70,,,,,
253,253,grovyle,"This Pokémon adeptly flies from branch to branch in trees.
In a forest, no Pokémon can ever hope to catch a fleeing
Grovyle however fast they may be.",1,1,384,ジュプトル,Juputoru,Juptile,Grovyle,Reptain,Massko,Grass,,,,,9,216,254,252,50,65,45,85,65,95,,,,,
254,254,sceptile,"Sceptile has seeds growing on its back. They are said to be
bursting with nutrients that revitalize trees. This Pokémon
raises the trees in a forest with loving care.",1,1,96,ジュカイン,Jukain,Jukain,Sceptile,Gewaldro,Jungko,Grass,,,,,17,522,,253,70,85,65,105,85,120,10065,,,,
255,255,torchic,"Torchic has a place inside its body where it keeps its flame.
Give it a hug—it will be glowing with warmth. This Pokémon is
covered all over by a fluffy coat of down.",1,1,512,アチャモ,Achamo,Achamo,Torchic,Flemmli,Poussifeu,Fire,,,,,4,25,256,,45,60,40,70,50,45,,,,,
256,256,combusken,"Combusken battles with the intensely hot flames it spews from
its beak and with outstandingly destructive kicks. This
Pokémon’s cry is very loud and distracting.",1,1,384,ワカシャモ,Wakashamo,Wakasyamo,Combusken,Jungglut,Galifeu,Fire,Fighting,,,,9,195,257,255,60,85,60,85,60,55,,,,,
257,257,blaziken,"Blaziken has incredibly strong legs—it can easily clear a
30-story building in one leap. This Pokémon’s blazing punches
leave its foes scorched and blackened.",1,1,96,バシャーモ,Bashāmo,Bursyamo,Blaziken,Lohgock,Braségali,Fire,Fighting,,,,19,520,,256,80,120,70,110,70,80,10050,,,,
258,258,mudkip,"In water, Mudkip breathes using the gills on its cheeks. If it is
faced with a tight situation in battle, this Pokémon will unleash
its amazing power—it can crush rocks bigger than itself.",1,1,512,ミズゴロウ,Mizugorō,Mizugorou,Mudkip,Hydropi,Gobou,Water,,,,,4,76,259,,50,70,50,50,50,40,,,,,
259,259,marshtomp,"Marshtomp is much faster at traveling through mud than it is at
swimming. This Pokémon’s hindquarters exhibit obvious
development, giving it the ability to walk on just its hind legs.",1,1,384,ヌマクロー,Numakurō,Numacraw,Marshtomp,Moorabbel,Flobio,Water,Ground,,,,7,280,260,258,70,85,70,60,70,50,,,,,
260,260,swampert,"Swampert predicts storms by sensing subtle differences in the
sounds of waves and tidal winds with its fins. If a storm is
approaching, it piles up boulders to protect itself.",1,1,96,ラグラージ,Ragurāji,Laglarge,Swampert,Sumpex,Laggron,Water,Ground,,,,15,819,,259,100,110,90,85,90,60,10064,,,,
261,261,poochyena,"Poochyena is an omnivore—it will eat anything. A distinguishing
feature is how large its fangs are compared to its body. This
Pokémon tries to intimidate its foes by making the hair on its
tail bristle out.",1,1,384,ポチエナ,Pochiena,Pochiena,Poochyena,Fiffyen,Medhyèna,Dark,,,,,5,136,262,,35,55,35,30,30,35,,,,,
262,262,mightyena,"Mightyena travel and act as a pack in the wild. The memory
of its life in the wild compels the Pokémon to obey only
those Trainers that it recognizes to possess superior skill.",1,1,96,グラエナ,Guraena,Graena,Mightyena,Magnayen,Grahyèna,Dark,,,,,10,370,,261,70,90,70,60,60,70,,,,,
263,263,zigzagoon,"The hair on Zigzagoon’s back is bristly. It rubs the hard back
hair against trees to leave its territorial markings. This Pokémon
may play dead to fool foes in battle.",1,1,384,ジグザグマ,Jiguzaguma,Jiguzaguma,Zigzagoon,Zigzachs,Zigzaton,Normal,,,,,4,175,264,,38,30,41,30,41,60,,,,,
264,264,linoone,"When hunting, Linoone will make a beeline straight for the
prey at a full run. While this Pokémon is capable of topping
60 mph, it has to come to a screeching halt before it can turn.",1,1,96,マッスグマ,Massuguma,Massuguma,Linoone,Geradaks,Linéon,Normal,,,,,5,325,,263,78,70,61,50,61,100,,,,,
265,265,wurmple,"Wurmple is targeted by Swellow as prey. This Pokémon
will try to resist by pointing the spikes on its rear at the
attacking predator. It will weaken the foe by leaking poison
from the spikes.",1,1,1536,ケムッソ,Kemusso,Kemusso,Wurmple,Waumpel,Chenipotte,Bug,,,,,3,36,266 268,,45,45,35,20,30,20,,,,,
266,266,silcoon,"Silcoon was thought to endure hunger and not consume
anything before its evolution. However, it is now thought
that this Pokémon slakes its thirst by drinking rainwater
that collects on its silk.",1,1,384,カラサリス,Karasarisu,Karasalis,Silcoon,Schaloko,Armulys,Bug,,,,,6,100,267,265,50,35,55,25,25,15,,,,,
267,267,beautifly,"Beautifly has a long mouth like a coiled needle, which is very
convenient for collecting pollen from flowers. This Pokémon
rides the spring winds as it flits around gathering pollen.",1,1,96,アゲハント,Agehanto,Agehunt,Beautifly,Papinella,Charmillon,Bug,Flying,,,,10,284,,266,60,70,50,100,50,65,,,,,
268,268,cascoon,"If it is attacked, Cascoon remains motionless however badly it
may be hurt. It does so because if it were to move, its body
would be weak upon evolution. This Pokémon will also not
forget the pain it endured.",1,1,384,マユルド,Mayurudo,Mayuld,Cascoon,Panekon,Blindalys,Bug,,,,,7,115,269,265,50,35,55,25,25,15,,,,,
269,269,dustox,"When Dustox flaps its wings, a fine dust is scattered all over.
This dust is actually a powerful poison that will even make a
pro wrestler sick. This Pokémon searches for food using its
antennae like radar.",1,1,96,ドクケイル,Dokukeiru,Dokucale,Dustox,Pudox,Papinox,Bug,Poison,,,,12,316,,268,60,50,70,50,90,65,,,,,
270,270,lotad,"Lotad is said to have dwelled on land before. However, this
Pokémon is thought to have returned to water because the
leaf on its head grew large and heavy. It now lives by floating
atop the water.",1,1,1536,ハスボー,Hasubō,Hassboh,Lotad,Loturzel,Nénupiot,Water,Grass,,,,5,26,271,,40,30,30,40,50,30,,,,,
271,271,lombre,"Lombre’s entire body is covered by a slippery, slimy film.
It feels horribly unpleasant to be touched by this Pokémon’s
hands. Lombre is often mistaken for a human child.",1,1,384,ハスブレロ,Hasuburero,Hasubrero,Lombre,Lombrero,Lombre,Water,Grass,,,,12,325,272,270,60,50,50,60,70,50,,,,,
272,272,ludicolo,"Upon hearing an upbeat and cheerful rhythm, the cells in
Ludicolo’s body become very energetic and active. Even
in battle, this Pokémon will exhibit an amazing amount
of power.",1,1,96,ルンパッパ,Runpappa,Runpappa,Ludicolo,Kappalores,Ludicolo,Water,Grass,,,,15,550,,271,80,70,70,90,100,70,,,,,
273,273,seedot,"Seedot looks exactly like an acorn when it is dangling from a
tree branch. It startles other Pokémon by suddenly moving.
This Pokémon polishes its body once a day using leaves.",1,1,1536,タネボー,Tanebō,Taneboh,Seedot,Samurzel,Grainipiot,Grass,,,,,5,40,274,,40,40,50,30,30,30,,,,,
274,274,nuzleaf,"This Pokémon pulls out the leaf on its head and makes a flute
with it. The sound of Nuzleaf’s flute strikes fear and uncertainty
in the hearts of people lost in a forest.",1,1,384,コノハナ,Konohana,Konohana,Nuzleaf,Blanas,Pifeuil,Grass,Dark,,,,10,280,275,273,70,70,40,60,40,60,,,,,
